"problemID";"clientID";"organisationID";"problemTypeID";"problemSubTypeID";"problemHeader";"problemDescription";"noOfPeopleAffected";"scope";"problemStatusID";"problemPriorityID";"assignedTo";"completedDate";"createdDate";"createdBy";"updatedDate";"updatedBy";"deletedDate";"deletedBy"
108;3;37;22;11;"organisation index sidebar shows puzzling info";"Organisation index sidebar makes no sense - just shows name of organisation and user name????";1;4;1;2;0;"";"2015-02-15 10:55:53";4;"2016-06-11 22:53:09";4;"2016-07-05 20:25:44";4
109;3;37;22;11;"Task detail screwed up";"Task detail page is screwed up and task details are displayed on right of page.";1;4;1;2;0;"";"2015-02-15 11:59:31";4;"";0;"2015-10-15 17:02:44";4
110;3;37;22;11;"si_auth and csrftoken dj cookies are not secure";"si_auth and csrftoken dj cookies are not secure cookies - should they be?";1;4;4;2;4;"";"2015-03-08 15:46:54";4;"2015-10-22 22:44:49";4;"2015-10-30 11:19:52";4
111;3;37;10;11;"Gantt chart screwed up on Dj";"Gantt chart not working.";1;4;4;1;0;"";"2015-03-29 16:32:48";4;"2015-04-19 16:23:34";4;"2015-04-19 16:26:25";4
112;3;37;10;11;"My Overdue Projects report fails";"Message: DataTables warning: table id=tbReportIndex - Ajax error. For more information about this error, please see http://datatables.net/tn/7";1;4;4;1;0;"";"2015-03-30 16:08:02";4;"2015-04-19 16:25:32";4;"2015-04-19 16:26:12";4
113;3;37;10;11;"My overdue tasks";"DataTables warning: table id=tbReportIndex - Ajax error. For more information about this error, please see http://datatables.net/tn/7

Error Number: 1054

Unknown column 'tkl.updatedID' in 'where clause'

call sr_report_my_overdue_projects(4)

Filename: /var/www/application/main/models/report_model.php

Line Number: 193";1;4;4;1;0;"";"2015-03-30 16:08:58";4;"2015-04-19 16:27:42";4;"2015-04-19 16:27:58";4
114;3;37;22;11;"No invoice history on index page";"Invoice index page has no history displayed.";1;4;1;2;0;"";"2015-04-10 17:02:03";4;"";0;"2015-10-15 17:03:09";4
115;3;37;7;11;"Thumbnail not created for big ping image";"When a large .png image i.e. 800k+ is uploaded to a project in Firefox (and maybe other browsers) no thumbnail is generated. However smaller and/or .jpg images work fine.";1;4;1;3;0;"";"2015-04-19 15:48:55";4;"2015-04-19 15:49:18";4;"2016-07-26 20:01:59";4
116;3;37;22;11;"On task update failure status lost";"When a task is updated including the status and there is a problem, the status of the task is lost i.e. not retained by the form.";1;4;1;3;0;"";"2015-04-19 16:08:16";4;"";0;"2015-10-30 21:37:06";4
117;3;37;22;11;"Non admin users in Dj can see Admin menu";"Non-admin users in Dj can see Admin menu they should not be able to see it.";1;4;1;1;0;"";"2015-04-19 16:18:36";4;"";0;"2015-10-15 17:11:14";4
118;3;37;22;11;"500 server error on logout.";"When users log out they get a 500 server error. But not on Firefox.
";20;4;1;1;4;"";"2015-09-25 07:39:37";4;"2015-10-15 21:22:12";4;"2015-10-16 10:51:59";4
119;3;37;22;11;"No help page for timegrid";"When user follows help link on timegrid page they see a page not found message.";20;4;1;3;4;"";"2015-09-25 07:40:57";4;"2015-12-19 22:37:49";4;"2016-07-28 19:26:20";4
120;3;37;10;11;"No feedback when problem edit malfunctions";"If edit problem and do not set assignee there is a silent error and the problem is not updated.";1;4;1;2;0;"";"2015-10-15 15:42:06";4;"";0;"2015-10-30 21:33:53";4
121;3;37;22;11;"Create user problem";"organisations duplicated in create user form and not ordered.";1;4;1;3;0;"";"2015-10-15 17:26:19";4;"";0;"2016-04-14 19:53:29";4
122;3;37;22;11;"New organisations not listed";"New organisations added can be seen in view/edit tabs but cannot be seen in organisation list";1;4;1;1;0;"";"2015-10-15 17:29:29";4;"";0;"2015-10-15 16:59:25";4
123;3;37;22;11;"dates formatted wrongly on invoice list";"Dates formatted strangely on invoice list: 2015-10-15T18:15:08Z";1;4;1;3;0;"";"2015-10-15 18:19:33";4;"";0;"2016-07-27 20:04:28";4
124;3;37;12;11;"New timesheet adds extra row with hours.";"New timesheet adds an extra row with hours.";1;4;1;1;0;"";"2015-10-15 18:20:49";4;"";0;"2015-10-30 20:44:05";4
125;3;37;22;11;"Newly created tasks cannot be edited.";"Newly created tasks cannot be edited.";1;4;1;1;4;"";"2015-10-16 14:50:22";4;"2015-10-30 13:04:20";4;"2015-10-31 12:26:38";4
126;3;37;22;11;"Project users cannot be deleted";"When a project user is added it cannot be deleted.";1;4;1;1;4;"";"2015-10-16 14:51:18";4;"2015-10-30 16:58:46";4;"2015-10-31 07:59:08";4
127;3;37;22;11;"Search does not work";"Search for simpris should bring back results but does not. This is being fixed. May just be datatables.";1;4;1;1;4;"";"2015-10-22 22:42:07";4;"2015-10-30 11:16:03";4;"2015-10-30 11:17:59";4
128;3;37;22;11;"Cannot update problems";"problem update causes nothing to happen. Stop press - it is actually working but gives no warning. Problem here also on create, is that validation is giving no warnings.";1;4;1;2;4;"";"2015-10-22 22:45:38";4;"2015-10-23 22:24:49";4;"2015-10-30 21:00:24";4
129;3;37;22;11;"Simpris menu points to home";"Simpris menu points to /home which is illegal url";1;4;1;1;0;"";"2015-10-23 22:23:07";4;"";0;"2015-10-30 11:18:38";4
130;3;54;8;13;"test organisation problem";"Test organisation problem";10;3;1;2;0;"";"2015-10-29 23:45:54";4;"";0;"2015-10-29 23:48:41";4
131;3;37;22;11;"Task status not updated on edit in spa";"When a task is edited the task status in the project overview page is wrongly displayed.  The task status has been updated and is displayed correctly on refresh.";1;4;1;2;4;"";"2015-10-30 11:37:29";4;"2015-11-21 00:11:51";4;"2016-02-24 19:59:23";4
132;3;37;22;11;"Problem type and subtype are not sorted correctly";"When adding new problem the drop downs are not sorted correctly.";10;4;1;3;0;"";"2015-10-30 11:38:56";4;"";0;"2016-02-24 20:01:23";4
133;3;37;22;11;"No feedback when new task is invalud";"When new task entered there is no validation feedback if field wrong.";1;4;1;1;4;"";"2015-10-30 11:54:02";4;"2016-02-24 19:57:45";4;"2016-02-24 21:31:08";4
134;3;37;22;11;"When task edit closes gap in table";"When user closes task edit it leaves a gap in the table.";1;4;2;4;0;"";"2015-10-30 16:56:19";4;"";0;"";0
135;3;37;22;11;"Inactive users show in user drop downs";"In project user drop downs active users feature.";1;4;2;1;4;"";"2015-10-30 16:57:40";4;"2015-10-30 17:00:00";4;"2015-10-30 21:33:22";4
136;3;37;22;11;"Datatables number of rows per page";"Datatables number of rows per page does not show up";1;4;1;4;4;"";"2015-10-30 17:01:18";4;"2015-10-30 17:01:30";4;"2016-07-19 19:11:35";4
137;3;37;22;11;"Page layout screwed on mobile";"Page layouts screwed on small mobile devices:

datatables widths wrong
menus wrong";1;4;2;1;4;"";"2015-10-30 17:09:58";4;"2015-10-30 20:19:43";4;"2015-11-16 20:59:22";4
138;3;37;22;11;"Notification email for project update";"Notification email for project update shows dodgy link. Needs changing as per registration email.";1;4;2;2;0;"";"2015-10-30 17:14:03";4;"";0;"2015-10-30 23:46:33";4
139;3;37;22;11;"Problem assignee can only be yourself";"Apparently users even admin users can only ad themselves as problem assignees.";1;4;1;1;0;"";"2015-10-30 21:00:05";4;"";0;"2015-11-16 21:48:25";4
140;3;37;22;11;"Task assign to user";"Users can only assign tasks to themselves";1;4;2;1;0;"";"2015-10-30 21:04:09";4;"";0;"2015-11-17 20:17:03";4
141;3;37;22;11;"Baffling error message on project update";"When update project with no manager/stakeholder set, baffling error message. Is JavaScript validation present? Is it working?";1;3;2;2;0;"";"2015-10-30 22:08:22";4;"";0;"2016-07-17 22:03:20";4
142;3;37;22;11;"Uploads not showing for comments";"Uploads do not show for comments. they are made successfully but do not show up in the list.";10;4;1;2;4;"";"2015-11-16 21:01:01";4;"2015-11-29 20:32:34";4;"2015-11-29 20:43:19";4
143;3;37;10;11;"Project spa screwed on mobile android ";"Project spa task edit shows blank task";1;4;1;2;4;"";"2015-11-20 23:50:59";4;"2015-12-19 22:37:09";4;"2016-04-12 20:55:58";4
144;3;37;22;11;"Gantt controls do not show in ipad";"Gantt controls missing in ipad";1;4;1;2;0;"";"2015-11-21 00:08:53";4;"";0;"2015-12-19 22:39:14";4
145;3;37;22;11;"Left hand panel of Gantt chart repeats data";"Oft hand panel of Gantt repeats data.";1;4;1;2;0;"";"2015-11-21 00:10:40";4;"";0;"2015-12-19 22:38:44";4
146;3;37;22;11;"Menus not collapsed properly on phone";"Menus not collapsed properly on android phone ";1;4;1;2;0;"";"2015-11-21 00:15:46";4;"";0;"2016-04-11 22:21:02";4
147;3;37;22;11;"Task edit in project spa shows blank ";"When edit task in project spa the popup form is blank and the code gives an error either too many rows found or task description not found ";1;4;1;1;0;"";"2015-11-21 21:40:23";4;"";0;"2015-11-21 22:41:36";4
148;3;37;22;11;"My organisations puzzling 1.3.1";"Organisations displayed make no sense for user-name.";1;4;1;2;0;"";"2015-12-17 19:46:20";4;"";0;"2016-07-04 20:38:43";4
149;3;37;22;11;"Cannot add organisations";"Internal server error on add organisation";1;4;1;1;0;"";"2015-12-17 23:40:53";4;"";0;"2015-12-19 22:36:30";4
150;3;37;10;11;"Cannot add fractions of hour in time";"When adding new time cannot add fractions of time.";1;4;1;1;0;"";"2015-12-25 22:35:22";4;"";0;"2015-12-28 12:40:15";4
151;3;37;22;11;"Prevent delete of active task not working";"User can delete active task";1;4;1;2;0;"";"2016-01-15 07:04:32";4;"";0;"2016-01-15 07:14:16";4
152;3;37;22;11;"Default task completion date set to 1970";"On update the completion date for tasks is set to 1970";1;4;1;1;0;"";"2016-02-11 20:19:21";4;"";0;"2016-02-24 21:31:14";4
153;3;37;22;11;"Cannot update task without setting phase";"Updates to task fail if no phase is set and there is no error message.";1;4;1;1;0;"";"2016-02-11 20:23:44";4;"";0;"2016-02-24 21:30:38";4
154;3;37;10;11;"Deleted or completed tasks show up in scedule";"Completed and maybe deleted tasks show up in schedule";1;4;1;1;0;"";"2016-02-24 19:40:33";4;"";0;"2016-02-24 19:56:17";4
155;3;37;22;11;"SPA task edit date picker no styles";"Datepicker calendar has no styles in SPA task edit.";1;4;1;1;0;"";"2016-02-24 20:00:19";4;"";0;"2016-02-24 20:18:31";4
156;3;37;22;11;"If a number of problems deleted messages show";"If a number of problems are deleted the message shows for each one i.e several stacked messages.";1;4;1;2;0;"";"2016-02-24 20:04:19";4;"";0;"2016-07-01 20:17:05";4
157;3;37;22;11;"No javascript validation of SPA task insert";"No validstion of SPA task insert ";1;4;1;2;0;"";"2016-02-24 21:32:14";4;"";0;"2016-03-23 18:53:29";4
158;3;37;22;11;"No javascript validation of SPA task edit";"No validation by javascript of edited tasks in SPA";1;4;1;2;0;"";"2016-02-24 21:33:09";4;"";0;"2016-03-23 18:52:47";4
159;3;37;22;11;"New phase does not save dates";"When new phase is created dates are not saved.";1;4;1;1;0;"";"2016-02-29 18:45:19";4;"";0;"2016-03-01 18:59:25";4
160;3;37;22;11;"On new registration creator not listed";"On new registration, the creator is not listed as an organisation user.";1;4;1;2;0;"";"2016-03-20 20:03:58";4;"";0;"2016-07-08 22:52:31";4
161;3;37;22;11;"On new or edit user multiple organisations";"On new registration multiple organisations shown for create new user and edit user.";1;4;1;2;4;"";"2016-03-20 20:06:27";4;"2016-04-14 19:52:28";4;"2016-04-14 19:53:00";4
162;3;37;22;11;"Timesheet display order";"Timesheet display order is wrong where multiple months are shown. Times are ordered grouped by the first 2 digits of the date.";1;4;1;2;0;"";"2016-03-23 18:51:09";4;"";0;"2016-03-25 19:43:27";4
163;3;37;22;11;"Cannot move tasks";"Server error on move of tasks";1;4;1;1;0;"";"2016-03-25 19:43:05";4;"";0;"2016-03-25 20:19:49";4
164;3;37;22;11;"Some users not visible.";"Some users not visible in detail when drill down from list.";1;4;1;1;0;"";"2016-03-25 20:23:25";4;"";0;"2016-04-14 19:23:22";4
165;3;37;22;11;"No validation on project update for stakeholder pr";"No validation on project update for stakeholder or project manager";2;4;1;2;0;"";"2016-03-27 19:41:11";4;"";0;"2016-07-14 18:16:46";4
166;3;37;22;11;"Search duplicates";"In search a search for 'linked' produces triplicated results.";1;4;4;1;0;"";"2016-03-27 21:44:51";4;"2016-06-24 21:12:41";4;"2016-06-24 21:16:56";4
167;3;37;22;11;"Search shows deleted tasks";"Search for email and you see the apparently deleted php email tasks.

Downgrade to minor problem as this is intended behaviour. ";1;4;1;4;4;"";"2016-03-27 22:00:04";4;"2016-04-14 19:31:28";4;"2016-07-19 19:09:47";4
168;3;37;22;11;"Lists wrong on mobile";"Some lists except problems wrongly displayed on mobile margins wrong. Home page way out.";1;4;1;2;0;"";"2016-04-12 21:02:41";4;"";0;"";0
169;3;37;22;11;"User organisation not shown on edit";"On user edit page the user's organisation shows blank in the dropdown list.

This is only a mobile problem so downgrade.";1;4;1;2;4;"";"2016-04-12 21:05:31";4;"2016-04-14 19:29:58";4;"2016-07-13 20:30:27";4
170;3;37;22;11;"Cannot edit problem without set assignee";"It is impossible to edit a problem without setting an assignee.....";1;4;1;1;0;"";"2016-04-14 19:34:11";4;"2016-04-15 17:47:07";4;"2016-04-15 17:47:48";4
171;3;37;22;11;"Edit user message afterwards";"When user edited if successful the message is shown in red.";1;4;1;3;0;"";"2016-04-14 20:07:30";4;"";0;"";0
172;3;37;22;11;"When change user email it does not update";"When a user;s email address is edited and updated it is not changed.";1;4;1;1;0;"";"2016-04-14 20:08:33";4;"";0;"2016-04-22 20:17:47";4
173;3;37;22;11;"User edit email does not accept some emails";"For some reason the user edit email does not accept the name BarratO@simpris.com. Puzzlingly this works fine on test.";1;4;1;1;0;"";"2016-04-14 20:09:28";4;"2016-05-20 18:12:17";4;"2016-05-20 20:14:55";4
174;3;37;22;11;"User edit cannot add new project";"Cannot add new project for user. Also at bottom of user edit is drop down to add projects for user. This shows a long list unordered and full of duplicates.";1;4;1;2;4;"";"2016-04-14 20:10:42";4;"2016-07-19 20:48:43";4;"2016-07-26 19:17:30";4
175;3;37;22;12;"Cannot cancel move project from project detail pg";"Cannot cancel move project dialogue from project detail page";1;4;1;3;0;"";"2016-04-14 20:50:38";4;"";0;"2016-07-28 19:31:12";4
176;3;37;22;11;"task detail linked tasks shows raw html";"Task detail linked tasks shows raw html.
Task 198 'new ideas' is an example";1;4;1;1;0;"";"2016-04-14 21:39:36";4;"";0;"2016-04-15 17:36:25";4
177;3;37;22;11;"On add new user cannot make them admins";"When adding a new user they cannot be made admins in the system 

or stakeholders

or project managers

This can be done afterwards in edit";1;4;1;3;4;"";"2016-04-19 20:44:06";4;"2016-07-19 17:27:51";4;"";0
178;3;37;22;11;"Ordinary user can add themselves to projects";"Ordinary users can add themselves to projects";1;4;1;1;0;"";"2016-04-19 20:44:57";4;"";0;"2016-04-22 19:48:50";4
179;3;37;22;11;"Ordinary users can delete themselves";"Ordinary users can delete themselves";1;4;1;1;0;"";"2016-04-19 20:46:53";4;"";0;"2016-05-18 18:15:49";4
180;3;37;22;11;"Ordinary users can add organisations";"Ordinary users can add organisations";1;4;1;1;0;"";"2016-04-19 20:48:29";4;"";0;"2016-04-22 19:51:10";4
181;3;37;22;11;"Ordinary users can delete their organisation";"Ordinary and admin users can delete their own organisation";1;4;1;1;0;"";"2016-04-19 20:49:45";4;"";0;"2016-07-01 19:59:56";4
182;3;37;22;11;"Ordinary users can edit teams";"Ordinary users can edit teams

and delete them too";1;4;1;1;0;"";"2016-04-19 20:51:15";4;"2016-04-19 20:57:35";4;"2016-04-22 19:49:06";4
183;3;37;22;11;"Ordinary users can create teams";"Ordinary users can create teams";1;4;1;1;0;"";"2016-04-19 20:52:37";4;"";0;"2016-04-22 19:48:58";4
184;3;37;23;11;"Ordinary users can see all metrics";"Ordinary users should not be able to see the top group of reports:
VIP summary
Overdue tasks by project
Overdue projects
Problems per project
Billed revenue per client
";1;4;1;1;0;"";"2016-04-19 21:02:10";4;"2016-04-21 19:57:05";4;"2016-04-22 19:41:52";4
185;3;37;22;11;"Time editor tasks dropdown has html";"Time editor tasks dropdown has html in it.";1;4;1;2;0;"";"2016-05-17 18:32:50";4;"";0;"2016-07-04 21:27:46";4
186;3;37;22;11;"In calendar html tags show for tasks";"In calendar html tags show for tasks";1;4;1;2;0;"";"2016-05-18 18:45:44";4;"";0;"2016-07-01 20:09:28";4
187;3;37;22;11;"Registration form screwed on ipad";"Registration form not formatted well on iPad. Input text fields are too wide for portrait mode.";1;4;1;2;0;"";"2016-06-11 22:49:40";4;"";0;"2016-07-08 22:43:50";4
188;3;37;22;11;"Programme user add/delete";"Programme user add or delete - error messages are not displayed just a blank panel.";1;4;1;2;0;"";"2016-06-12 22:27:02";4;"";0;"";0
189;3;37;22;11;"Project edit and org edit";"Project edit and org edit are not showing user as context not passed through";1;4;1;1;0;"";"2016-07-14 18:23:47";4;"";0;"2016-07-19 17:25:36";4
190;3;37;22;11;"No validation on project create";"No validation on project create. No messages show if error.";1;4;1;1;0;"";"2016-07-14 18:24:40";4;"";0;"2016-07-14 23:23:23";4
191;3;37;22;11;"On iPad project view priority and status don't wor";"Right most 2 columns do not show on project tasks table on project detail page.";1;4;1;2;0;"";"2016-07-26 21:52:52";4;"";0;"";0
